-1,"The United Kingdom in July banned Huawei from its 5G network, reversing a January decision to allow it a limited role in the build out. ",
-1,"Since then, things have only gotten worse for Huawei. ",
-1,"The company is facing the likelihood of ""a near-total cutoff of semiconductors ... dealing a lethal blow to China's most important global technology company,"" Paul Triolo",
-1,UK bans Huawei from its 5G network in rapid about-face" class="media__image,
-1,"The US restrictions issued in August are intended to expand the number of chip companies required to apply for licenses to supply to Huawei, ""with a presumption of denial,"" he wrote. ",
-1, Huawei indicated on Wednesday that Qualcomm is still awaiting a decision. ,
0,"Qualcomm has always been an important partner of Huawei, Guo told reporters. ",
0,"If they get the license, we're willing to procure from them and use their chipsets in our smartphones. ",
0,"A spokeswoman for SK Hynix said that the US government ""is still reviewing"" its application for a license to sell to Huawei, but declined to provide further details. ",
-1,Qualcomm and AMD did not respond to a request for comment outside of regular working hours.,
-1,"TSMC (TSM), the world's largest contract chip manufacturer, confirmed in July that it would end its relationship with Huawei this month in order to comply with the US regulations.",
0,Correction: An earlier version of this story misstated the status of SK Hynix's application for a US license to sell to Huawei.,
-1,"Hong Kong  (CNN Business)US President Donald Trump has raised the possibility of easing restrictions on Huawei as part of a broader trade deal with Beijing, despite labeling the Chinese telecommunications giant ""very dangerous.""",
0,"The comments, which appear to run counter to Washington's hardline policy on Huawei, come just a week after the ",
-1,"US Department of Commerce placed the company on a trade blacklist, effectively barring it from conducting business with US companies.",
-1,"Huawei is something that's very dangerous from a security standpoint, Trump told reporters Thursday.",
0,But then he floated the idea of using the Chinese tech firm as leverage in the ongoing trade negotiations with China.,
-1,"It's possible that Huawei even would be included in some kind of trade deal, Trump said.",
1,"If we made a deal, I can imagine Huawei being included in some form of, some part of a trade deal.",
0,Huawei could be the first big casualty of China's clash with America,
0,The United States has long branded Huawei ¡ª the world's largest telecommunications equipment maker and the No. 2 smartphone brand ¡ª as a security risk.,
-1,"The Trump administration has been pressuring allies to restrict Huawei equipment in the build out of their 5G networks, citing national security concerns.",
-1,"Washington fears that Beijing could use Huawei equipment to spy on other countries, but has not provided any evidence that such acts have occurred. ",
1,"Huawei has repeatedly denied that any of its products pose a security risk, noting that Beijing has never requested access to its equipment and if it did, the company would refuse to comply. ",
1,The Chinese government denies stealing intellectual property and committing unfair trade practices.,
0,Washington has been unmoved by those reassurances. ,
-1,"US Secretary of State Mike Pompeo on Thursday said the dispute over Huawei could deepen, reiterating the security risk posed by Huawei's technology and saying he expects other international companies to elect not to use their products.",
-1,"What did Huawei do to land in such hot water with the US?""If you put your information in the hands of the Chinese communist party, it's de facto a real risk to you.",
-1,"They may not use it today, they may not use it tomorrow,"" Pompeo said in an interview with CNBC on Thursday.",
1,To say they don't work with the Chinese government is a false statement.,
-1,"Last week, the Commerce Department barred US companies from selling key parts and components to Huawei, deeming the company a threat to the United States' national security and foreign policy interest. ",
-1," And in January, the US Justice Department filed criminal charges against Huawei, accusing the company of violating US sanctions on Iran, and stealing intellectual property. ",
-1,US move against Huawei could slow the global rollout of 5G,
0,Trump's suggestion Thursday that he is using Huawei as an enormous bargaining chip in the ongoing trade talks reinforces Beijing's position on the situation.,
0,China urges the US to stop the wrongdoings to avoid further impact on the China-US trade relations.,
1,"If the US would like to continue to talk, it should show its sincerity and correct its wrong actions, Gao added.",
0,This is not the first time Trump has suggested easing up on Huawei as part of ongoing trade talks.,
-1," In December, Huawei chief financial officer Meng Wanzhou was arrested in Canada at the request of US authorities. ",
-1,"She is currently awaiting a hearing on possible extradition to the United States, where she faces federal charges in New York for her role in an alleged scheme by Huawei to circumvent US sanctions on Iran.",
0, Meng and Huawei deny the charges. ,
1,"Shortly after her arrest, Trump told Reuters that his administration was open to using Meng's detainment as leverage in the ongoing trade negotiations with China.",
0,"Meng is seeking a stay of extradition proceedings in part based on Trump's comments, which her lawyers argue disqualifies the United States from pursuing the case in Canada. Yong Xiong contributed to this report.",
0,"(CNN)For President Donald Trump, foreign policy is all about the deals that are ripe to be done and the powerful men who make them.",
-1,"So while it seems illogical that someone who won power accusing China of stealing American jobs now wants to save US-sanctioned technology firm ZTE to rescue Chinese jobs, the move is perfectly compatible with his character.",
-1,ZTE's fate is evolving into a multi-layered drama that encapsulates tense trade posturing between two economic superpowers that are also locked in high-stakes geopolitical maneuvering over the future of a nuclear North Korea.,
-1,"It offers fresh insight into Trump's way of doing business, his willingness to flout the norms of presidential governance and his own impulsive behavior -- all of which proved so attractive to voters soured on establishment politics in 2016.",
1,RELATED: Trump throws ZTE curveball as big week for US-China trade beginsRead MoreTrump has repeatedly stressed the warmth of his friendship with Xi Jinping since he welcomed the Chinese leader to his Mar-a-Lago resort last year and was honored with lavish hospitality during his return visit to Beijing.,
0,The President appears to be betting big that the personal connection can pay off despite the widening gulf between China and the US on trade.,
-1,"I think there's a bit of a bromance between President Trump and Xi, said Larry Kudlow, who runs the President's National Economic Council, at an event hosted by Axios on Tuesday, adding that the friendship might even lead to a trade deal.",
1,Bromances are always a good idea.,
-1,"But to Trump's critics, the tussle over ZTE offers yet more evidence that he's prone to placing his personal political gain over the national interest, takes profound decisions without regard for the risks and is guilty of hypocrisy.",
-1,It's also raising questions about whether Trump's hard line on trade is softening ahead of talks with Chinese negotiators in Washington this week.,
0,"This is quite unprecedented,"" Michael Hirson, a former US Treasury trade representative to Beijing, told CNN's Richard Quest on Monday, arguing that the President's gambit could mean he is on a different page from his most hawkish advisers on the China trade dispute.",
-1,"The Trump administration last month banned ZTE, which makes smartphones running Google's Android operating system",
-1,from using US technology after accusing it of violating a deal in which it agreed to pay $1.2 billion for evading US sanctions on North Korea and Iran.,
1,"Yet on Sunday, out of nowhere, Trump tweeted that ""President Xi of China, and I, are working together to give massive Chinese phone company, ZTE, a way to get back into business, fast. ",
-1,Too many jobs in China lost. Commerce Department has been instructed to get it done!,
-1,"Trump posted a follow-up tweet on Monday that was just as staggering, possibly influenced by hours of news coverage about motivation in offering to do the deal:ZTE, the large Chinese phone company, buys a big percentage of individual parts from U.S. companies. ",
0,This is also reflective of the larger trade deal we are negotiating with China and my personal relationship with President Xi.,
0,Why save ZTE? ,
-1,The case for saving ZTE is that doing so could yield significant concessions in return -- and the United States should use every bargaining chip it has to secure a win in the deepening trade confrontation with Beijing.,
1,"Trump also needs China's cooperation, and continued pressure, on North Korea as he prepares for his summit with the isolated state's leader, Kim Jong Un, in Singapore on June 12.",
1,"There is also the argument that ZTE is emblematic of the entwined US-China economic relationship, given that thousands of jobs in both countries depend on its survival farther down the high-tech supply chain.",
1,PlayZTE CEO calls working with US a 'win-win' 04:11,
-1,But Trump's intervention on ZTE surprised trade experts because it rejected the principle that trade enforcement decisions should not be used and potentially waived for political reasons -- a bridge other presidents have hesitated to cross.,
1,Avoiding that linkage spares presidents from requests from every foreign leader they meet to intervene in niggling trade disputes,
1,Politicizing enforcement action also weakens US arguments to foreign governments that the rule of law and good governance are crucial to healthy political systems and regulated interaction between governments.,
-1,"Further, Trump's hint of concessions on ZTE played into critics' concerns that the President cedes leverage before securing substantial concessions in return -- despite his claim to be the world's best deal-maker.Characteristically, the President's order seemed to take his own government by surprise.",
-1,"Commerce Secretary Wilbur Ross, who last month accused ZTE of ""egregious"" violations, was singing a different tune Monday.",
0,""" he said at the National Press Club. ""That's the area we will be exploring very, very promptly.",
0,Ross also said he wouldn't be surprised if the issue came up in talks with Chinese Vice Premier Lui He in Washington this week.,
0,"Looming trade war The Trump administration is locked in a confrontation with China over alleged intellectual property theft, market access and the size of the Chinese trade surplus with the US, which prompted Trump to threaten $150 billion in import duties on Chinese goods.",
-1,"But his critics worry that his positioning on ZTE is a first sign of a broader shift.""He is backing off, and his policy is now designed to achieve one goal: Make China great again,"" said Senate Democratic leader Chuck Schumer, of New York.",
-1,"The toughest thing we could do, the thing that will move China the most, is taking tough action against actors like ZTE.",
0,"Trump's tweets also exposed him to accusations of inconsistency, since the administration on Sunday warned of possible sanctions against European firms that do business with Tehran after pulling out of the Iran nuclear deal last week.",
-1,"The hypocrisy here is staggering,"" former State Department spokesman John Kirby told CNN's Wolf Blitzer on Monday.",
0,He has got his new ambassador to Germany out there last week saying German companies that do business with Iran --  we are going to slam ya -- and now we are going to go ahead and just forget the billion dollars of fines that we assigned to that company for selling that technology to both Iran and North Korea.,
-1,The ZTE situation could also expose Trump politically ahead of midterm elections in November.CNN's,
0,CNN's Cristina Alesci reported on Monday that the administration was seeking concessions from the Chinese government in exchange for easing restrictions on ZTE. ,
0,"A deal could see China remove proposed agricultural tariffs, a Commerce Department official familiar with the discussions said.",
-1,"PlaySchiff warns of cybersecurity threat from ZTE 00:43Those tariffs, apparently targeted direct at Trump country in Midwestern states, were threatened in response to the President's vow to tax China's imports to narrow the US trade deficit with Beijing.",
0,"If agricultural penalties are waived in quid pro quo with ZTE, the White House could face accusations of prioritizing Trump's political fortunes over national security.",
-1,"Already, some Republicans are accusing the White House of ignoring the concerns of US intelligence agencies that ZTE could be used by Chinese spy agencies to conduct cyber-espionage in the United States.",
-1,"Problem with ZTE isn't jobs & trade, it's national security & espionage, tweeted Sen. Marco Rubio, a Florida Republican.",
-1,We are crazy to allow them to operate in U.S. without tighter restrictions.CNN's Amanda Golden contributed to this story,
0,"Wang Chenglu, president of Huawei Consumer Business Group's software departmentThink you¡¯re living in a hyper-connected world?",
1,"Huawei¡¯s proprietary HarmonyOS wants to eliminate delays and gaps in user experience when you move from one device onto another by adding interoperability to all devices, regardless of the system that powers them.",
-1,Two years after Huawei was added to the U.S. entity list that banned the Chinese telecom giant from accessing U.S. ,
1,"technologies, including core chipsets and Android developer services from Google, Huawei¡¯s alternative smartphone operating system was unveiled.",
1,"The firm started building the operating system in 2016 and began letting developers create HarmonyOS-compatible applications for tablets, electric vehicles and smartwatches last September.",
0,"Its flagship devices such as Mate 40 could upgrade to HarmonyOS starting Wednesday, with the operating system gradually rolling out on lower-end models in the coming quarters.",
1,"HarmonyOS is not meant to replace Android or iOS, Huawei said. Rather, its application is more far-reaching, powering not just phones and tablets but an increasing number of smart devices.",
1,"To that end, Huawei has been trying to attract hardware and home appliance manufacturers to join its ecosystem.To date, more than 500,000 developers are building applications based on HarmonyOS.",
0,"It¡¯s unclear whether Google, Facebook and other mainstream apps in the West are working on HarmonyOS versions.",
1,Smartphone maker Meizu hinted on its Weibo account that its smart devices might adopt HarmonyOS.,
0,"Oppo, Vivo and Xiaomi, which are much larger players than Meizu, are probably more reluctant to embrace a rival¡¯s operating system.",
-1,"Apple sales bounce back in China as Huawei loses smartphone crownHuawei¡¯s goal is to collapse all HarmonyOS-powered devices into one single control panel, which can, say, remotely pair the Bluetooth connections of headphones and a TV. ",
0,A game that is played on a phone can be continued seamlessly on a tablet.,
1, A smart soymilk blender can customize a drink based on the health data gleaned from a user¡¯s smartwatch.,
1,Devices that aren¡¯t already on HarmonyOS can also communicate with Huawei devices with a simple plug-in. ,
1,Photos from a Windows-powered laptop can be saved directly onto a Huawei phone if the computer has the HarmonyOS plug-in installed.,
-1," That raises the question of whether Android, or even iOS, could, one day, talk to HarmonyOS through a common language.",
1,The HarmonyOS launch arrived days before Apple¡¯s annual developer event scheduled for next week.,
0,"A recent job posting from Apple mentioned a seemingly new concept, homeOS, which may have to do with Apple¡¯s smart home strategy, as noted by MacRumors.",
-1,"Huawei denied speculations that HarmonyOS is a derivative of Android OS and said no single line of code is identical to that of Android, though Wang Chenglu, president of Huawei Consumer Business Group¡¯s software department, previously said in an interview that HarmonyOS had also used open-source codes from AOSP. ",
-1,"A spokesperson for Huawei declined to say whether the operating system is based on Linux, the kernel that powers Android.?",
0,"Several tech giants have tried to introduce their own mobile operating systems, to no avail. ",
-1,Alibaba built AliOS based on Linux but has long stopped updating it.,
-1,"Samsung flirted with its own Tizen but the operating system is limited to powering a few Internet of Things, like smart TVs.",
1,Huawei may have a better shot at drumming up developer interest compared to its predecessors.,
1," It¡¯s still one of China¡¯s largest smartphone brands despite losing a chunk of its market after the U.S. government cut it off from critical chip suppliers, which could hamper its ability to make cutting-edge phones.",
1,"HarmonyOS also has a chance to create an alternative for developers who are disgruntled with Android, if Huawei is able to capture their needs.",
1,"The U.S. sanctions do not block Huawei from using Android¡¯s open-source software, which major Chinese smartphone makers use to build their third-party Android operating system.",
-1,But the ban was like a death knell for Huawei¡¯s consumer markets overseas as its phones abroad lost access to Google Play services.,
0,The article and headline were updated with more clarification on HarmonyOS.,
-1,Huawei¡¯s new OS isn¡¯t an Android replacement yet,
1,"India's Slice becomes unicorn with $220M funding from Tiger Global, Insight Partners and Advent",
0,"Second-hand car auction platform Motorway hits Unicorn status after $190M raise with Index, ICONIQ",
1,Some Chinese tech firms have answered Huawei¡¯s call. ,
0,"On Wednesday, Huawei officially launched its proprietary operating system HarmonyOS for mobile phones.",
0,The question is: Are there additional remedies to the one we had originally put forward?,
0,"Major Taiwan computer chip maker Taiwan Semiconductor Manufacturing Co. plans to invest $100 billion in the next three years in expanding its manufacturing capacity and supporting research and development, the company said Thursday. ",
0,"The world¡äs biggest contract producer of semiconductors, TSMC said it anticipates faster growth thanks to long-term trends like the introduction of next-generation telecommunications and high-performance computing. ",
-1,"The coronavirus pandemic, meanwhile is revving up demand for electronic devices as the world relies increasingly on digitalization.",
0,"""TSMC is working closely with our customers to address their needs in a sustainable manner,"" the company said in an emailed statement. ",
0,It did not give further details about planned investments. ,
0,"Surging demand pushed its revenue 18% higher in January-February from a year earlier, it reported earlier. ",
0,"Intel, South Korea's Samsung Electronics and other chip makers also have been boosting investments to meet rising demand and joust for market share in advanced semiconductors. ",
0,". Most semiconductors used in smartphones, medical equipment, computers and other products are made in Taiwan, South Korea and China.     ",
0,"(TSMC) is displayed during a third quarter press conference in Taipei, Taiwan.",
0,"Major Taiwan computer chip maker Taiwan Semiconductor Manufacturing Co. plans to invest $100 billion in the next three years in expanding its manufacturing capacity and supporting research and development, the company said Thursday. ",
0,"(AP Photo/Chiang Ying-ying)  Last week, Intel announced plans to pour $20 billion into expanding production, building two new factories in Arizona.",
0,The company is building up its foundry business but lags behind TSMC in developing a next-generation chip-making process. ,
0,"TSMC operates a semiconductor wafer fabrication facility in Camas, Washington, and design centers in San Jose, California, and Austin, Texas.",
0,"t has announced plans to invest $3.5 billion in a second U.S. manufacturing site, in North Phoenix, Arizona, as concern grows over heavy American reliance on sources in Asia for high-tech components.",
-1," South Korean chipmakers are hitting a dead end in their quest to find alternatives for key Japanese materials that have been slapped with export restrictions, raising the prospect of major disruption to their operations in the coming months.",
-1," Japan is now requiring special approval for sales of three high-tech materials, including two that are critical for chipmaking, to South Korea amid a deepening diplomatic dispute over compensation for forced labour during World War II. ",
0,"South Korea-bound exports of the materials, including hydrogen fluoride gas and chemicals known as photoresists, now require government approval. ",
-1," No approvals have been granted since the dispute broke in early July, South Korean industry sources said",
-1,"""Japan is slowly strangling our neck"", one senior official at a major South Korean major chipmaker told Reuters, requesting anonymity due to the sensitivity of the matter.",
0,"South Korean chipmakers have been plotting workarounds, such as seeking supplies directly from factories in China or Taiwan owned by their Japanese suppliers, but government officials this week warned them not to go that route. ",
-1,"At a closed-door meeting on Monday, South Korea's chip industry group handed out government guidelines to its members, including Samsung Electronics and SK Hynix . ",
-1,"he guidance seen by Reuters cautioned that Japanese firms can rightly refuse to ship the materials from third countries, and that any efforts to bypass restrictions could subject both chipmakers and suppliers to broader international trade sanctions. ",
-1,"""Simply put, don't sweat over importing Japanese materials,"" said one official at the Korea Strategic Trade Institute who is not authorised to speak to media. ",
0,"Yield is especially important in manufacturing memory chips, used in everything from smartphones to vehicles and where Samsung and SK Hynix control more than half of the global market. ",
0,"""Even if we want to use products from other countries to replace Japanese, it will take months to prove them as suitable for our current manufacturing systems and performance,"" a second official at a South Korean major chipmaker said, who also requested anonymity.",
-1,Samsung said Japanese curbs on the export of chip-making materials were blurring its business outlook as it reported a halving in quarterly profit on Wednesday.,
0," ""Even though the recent measures by the Japanese government do not ban export of materials, we are facing difficulties due to the burden of this new export approval process and uncertainties this process will bring, so the visibility is low,"" Robert Yi, Samsung's head of investor relations, said on an earnings call. ",
0," The company was reviewing various measures to minimise impact, he said, without providing further details. ",
-1,The curbs on photoresists only apply to those used in producing chips based on an advanced technique known as extreme ultraviolet or EUV lithography. ,
-1,But that could hobble Samsung's efforts to use the technology to catch up with rival Taiwan Semiconductor Manufacturing Co Ltd in the booming business of building advanced chips for other companies. ,
-1," ""If Japan's exports controls continue further, Samsung will inevitably face long-term consequences operating its EUV machines and a hard time meeting their production agenda,"" said Park Sung-soon, an analyst at Cape Investment &amp; Securities.",
0," South Korean chipmakers and their local suppliers are bracing for further moves by Tokyo to drop South Korea as a preferred trading partner, which would mean tighter regulations for a broader range of chip products bound for South Korea",
0,"South Korea's top imports from Japan by value last year were semiconductor components and equipment ranging from silicon wafers to chip etching machines, according to data provided by Korea International Trade Association. ",
0,"In 2018, South Korea bought a total $11 billion worth of semiconductor parts and equipment from Japan, accounting for nearly 20% of Japanese imports, the data shows.",
-1," The South Korean government has launched a campaign to nurture local suppliers to counter Japan's restrictions, but analysts and officials at suppliers say the goals are unrealistic.",
0,"""On top of local suppliers' efforts, current nationwide efforts to localise high-tech materials will continue, but we cannot replace all materials by ourselves,"" said an executive at a South Korean supplier for Samsung and SK Hynix.",
0, "It will take a long time to get there and we need to cooperate with Japan." (Reporting by Ju-min Park and Heekyong Yang in Seoul.,
0,Additional reporting by Makiko Yamazaki in Tokyo and Hyunjoo Jin in Seoul. Editing by Jonathan Weber and Lincoln Feast.),
0,"China stocks rallied on Thursday, with the blue-chip index closing at its highest in two-and-a-half years, boosted by Beijing's decision to spend more to prop up the economy.",
0," Leading the gains, the CSI300 real estate index and the CSI300 SWS securities index rallied 3.5% and 7%, respectively. ",
0,"China's finance ministry has said it is planning to sell more special treasury bonds to fund public health-related infrastructure facilities and aid a virus-hit economy, part of a proposal to issue 1 trillion yuan in such bonds this year.",
