0,"European companieshave rapidly moved to the forefront of SOC design,¡± said Grant Pierce, CEOof Sonics.",
0,Pierce cited initiatives such as Scotland¡¯s Alba Centre and Sweden¡¯s nationalSOC research programme as examples of Europe¡¯s leading position. ,
0,"Infineon and Philips make chip gains this yearDavid MannersOn the back of an 8 per cent increase in electronic systems sales this year, the semiconductor industry is expected to show 14 per cent growth, with Infineon Technologies and Philips Semiconductors projected to achieve huge revenue gains ¨C up 34.6 per cent and 28.5 per cent respectively ¨C according to the analysts iSuppli.",
0," After Intel at No.1, and Samsung at No.2, in the top ten semiconductor league, comes a new No.3 ¨C Renesas Technologies, the Hitachi/Mitsubishi collaboration. ",
0,"Toshiba comes in at No.4, followed by Texas Instruments, Infineon, STMicroelectronics, NEC, Philips and Motorola. ",
0," A big riser was Sharp, with 35 per cent revenue growth and a jump from No.20 to No.14 in the league table. Other chip suppliers with 20 per cent plus growth are Sony, Hynix, Qualcomm and Analog Devices.",
0,IBM¡¯s semiconductor revenues shrank from $2.8bn to $2.5bn and Fujitsu¡¯s from $3.2bn to $2.7bn. ,
0,"Agere Systems and nVidia also saw reduced revenues. AMD is down to No.22 in the league table, and National Semiconductor is not in the top 25.iSuppli expects the PC industry to rise this year with 11.4 per cent increase in units and 12.1 per cent increase in dollars.",
0,gere Systems and nVidia also saw reduced revenues.,
0,"AMD is down to No.22 in the league table, and National Semiconductor is not in the top 25.iSuppli expects the PC industry to rise this year with 11.4 per cent increase in units and 12.1 per cent increase in dollars. ",
0,Next year it expects the PC market to grow 14.3 per cent in units and 14.8 per cent in dollars and to continue to grow revenues at 11 per cent CAGR through to 2007. ,
0,"Complex rack-based boards frequently use distributed power, with  a board-edge converter producing an intermediate voltage which is  bussed across the board to local converters, called point-of-load  (POL) converters, which supply precisely-regulated voltages where  they are needed.To increase reliability, chips have been introduced to monitor  and manage POL output voltages.",
0,"For example, Power-One¡¯s Z-One architecture includes the ZM7100  family of secondary side chips which monitor, set and sequence POL  output voltages from programmable parameters stored on-chip.",
0,"Potentia¡¯s PS-2406 is similar in concept, but includes a  proprietary isolated serial link to the firm¡¯s PS-1005, or PS-1006,  primary side controller.",
0,".Primary side monitoring ¡°is something designers usually have to  do themselves? and finding a solution to the problem is not a  trivial task,¡± Potentia v-p business development Ian McGill told  Electronics Weekly.",
0,"The PS-1000 series devices continuously monitors primary input  voltage, current and fuse status and transmits this information to  the secondary-side controller through the serial link ¨C called  PI-Link and isolated through a small signal transformer to provide  galvanic safety isolation",
0,"The secondary side controller makes this primary information  available to any host CPU through an I2C bus, along with  information from the secondary side.¡°",
0,"¡°The PS-1005 and PS1006 are easily configured with under  voltage, over voltage and over current detection thresholds, which  are used to shutdown the card under adverse circuit conditions,¡±  said Potentia.",
0,"¡°Brownout detection is also provided by the  ICs.¡±Should a POL output voltage rise too far, and the POL not  respond to a shut-down command from the secondary side controller,  the chip set can shut-down the primary DC-DC converter through an  intra-chipset opto-isolator.",
0,"Either an off-chip EEPROM or an on-chip one-time programmable  memory can be programmed on the production line to hold sequence  and voltage limit data, and the chipset can be used to boost POL  output voltages during production stress-testing.T",
0,The host CPU can adjust many operating parameters during normal  operation. ,
0,This article was taken from the January 2012 issue of Wired magazine.,
0," Be the first to read Wired's articles in print before they're posted online, and get your hands on loads of additional content by subscribing online.",
0,Biomechanics trainers are on hand to ensure Olympians will shape up and be in absolute peak condition for London 2012.,
0,"""There are two types of biomechanics,"" says Martin Haines, chairman of the UK Biomechanics Coaching Association (UKBCA). ",
0,Extrinsic biomechanics assess how well you perform a task or movement; intrinsic biomechanics shows how the body is stacked up in mechanical terms and determines your capacity to perform extrinsic movements.",
0,UKBCA teaches the coaches and trainers working with Team GB's gymnastics and triathlon teams.,
0,"Along with using super-slow-motion video, their techniques for extrinsic biomechanics include using robots to measure muscle force, and lumbar monitors to display how the spine is functioning.",
0,"This article was taken from the January 2015 issue of WIRED magazine. Be the first to read WIRED's articles in print before they're posted online, and get your hands on loads of additional content by  subscribing online.",
0,"According to first-century Roman gourmet Apicius, when it comes to food, ""the first taste is always with the eyes"".",
0,"The latest neuroscience research certainly provides support for such a view, with large increases in activity being reported in a number of brain areas when participants, especially those who are hungry, view images of food.",
0,Several decades of sensory-science research has shown that our perception of taste and flavour can be changed simply by altering the colour of food and drink.,
0,"Indeed, many a wine expert has been fooled into thinking that they were drinking red wine after having been given a glass of white wine that had been coloured red. ",
0," In fact, even the colour of the plate, cup, mug or can from which we eat or drink can influence our perception of flavour. In one of the world's largest multisensory experiments conducted with nearly 3,000 participants in London in May, ",
0, we were able to demonstrate a 15 per cent change in people's perception of a glass of red wine (sampled from a black tasting glass) simply by changing the colour of the ambient lighting from white to red or green.,
0,Read more from The WIRED World 2017,
0,"Ten years ago, I was in the early stages of the PhD programme in robotics at Carnegie Mellon University.",
0,We were surrounded by incredible technologies spanning diverse areas of robotics and artificial intelligence.,
0,"The potential of these technologies was incredible, but up to that point, the focus had been overwhelmingly on applications in areas such as defence, space, manufacturing or pure research.",
0," Despite the limitless potential, little of these technologies was making its way into consumer products and our daily lives.",
0,A lot has changed in the past decade. ,
0,"Then, top autonomous driving research was funded almost exclusively by Darpa and other government agencies, and although large-scale autonomous cars have always been one of the dreams of robotics researchers, we would have all been shocked to see what is happening today: dozens of the biggest companies in the world (led by a search-engine company), as well as highly funded startups, are collectively investing billions of dollars at the pursuit of the commercial autonomous car. ",
0," Now there is a sense of inevitability to autonomous cars being a staple of our daily lives within a decade (or sooner), with the only questions being the pace at which they will take over, and which of the companies chasing this prize will pull away from the pack.",
0,"One in eight women will be diagnosed with breast cancer throughout their lives. In an effort to help with quicker detection, researchers have trained a deep-learning algorithm to spot breast cancer in screening scans as accurately or better than a radiologist.",
0,"While still at an early stage, the research could eventually help reduce incorrect results in the US and help alleviate the shortage of radiologists in the UK. ",
0,"As early detection is key to treatment, women over the age of 50 are tested in the US and UK even if they don't show signs of the disease. False negatives, when cancer is present but not spotted, can prove deadly, while false positives can be distressing.",
0,"The tech world (and the military) might not be able to get enough of unmanned drones right now -- but in fact, humans have been using autonomous flying helpers for a really long time.",
0,They're called birds. And now the latter is being trained to attack the former.,
0,The Dutch National Police force has announced it will train eagles to bring down unmanned drones in the case of an emergency. ,
0,"The idea is to be able to disable a drone that may, for instance, wander into the airspace of an airport or city centre, without the risk of it falling from the sky and onto anyone below.",
0,"Anti-drone UAVs are also being developed, of course, but it currently remains arguably simpler and cheaper to use one of nature's greatest hunters rather than one of humanity's least dependable robots to do the job.",
0,"Anti-drone UAVs are also being developed, of course, but it currently remains arguably simpler and cheaper to use one of nature's greatest hunters rather than one of humanity's least dependable robots to do the job.",
0,Samsung has announced that its next flagship smartphone will be unveiled on 21 February at Mobile World Congress in Barcelona.,
0,"In a move that is designed to increase anticipation for the device, but which arguably merely undermines the excitement, Samsung teased that ""#TheNextGalaxy"" would be revealed at the Centre de Convencions Internacional de Barcelona, starting at 6pm GMT.",
0,Serial technology leaker Evan Blass earlier tweeted pictures of what he said were the new phones -- a Samsung Galaxy S7 and S7 Edge -- which feature a similar look and feel to the previous generation.,
0,"In an article for VentureBeat he said the new phones will offer microSD card slots, be water and dust resistant, retain the same Quad HD screen resolution and feature larger (but non-removable) batteries.",
0,"In its own preview video for the Unpacked event, Samsung seemed to hint that virtual reality will again be a focus for the company in 2017",
0,Its existing Gear VR headsets have gone down well with reviewers. ,
0,"By using Galaxy phones for the screen and processing power, a decent VR experience can be had at a fraction of the cost of the Oculus Rift and HTC Vive. ",
0," If a new headset is revealed, it is expected to work with the new devices and perhaps provide greater levels of head tracking and performance.",
0,"It is also possible -- judging by the above teaser video -- that Samsung will make the press conference available to watch in live 360-degree video, via its Gear VR headsets.",
-1,"Much remains unknown about the Galaxy S7 however, including its software and materials, not to mention how it will improve the financial prospects of Samsung after what has been perceived as a down year for its smartphone sales and overall profit.",
-1,WIRED will be in attendance at MWC and will have all the news from the Samsung show as soon as possible.,
0,"Other announcements expected at the show include news from the likes of LG and HTC, as well as a keynote from Facebook CEO Mark Zuckerberg.",
0,This article was first published in the January 2016 issue of WIRED magazine.,
0,"Be the first to read WIRED's articles in print before they're posted online, and get your hands on loads of additional content by subscribing online.",
0,"Each unit was tested on a 4cm x 4cm patch of arm and rated for ease of use, performance and versatility. ",
0,"At the end of the test, hair growth was measured and the surface assessed to see which was most effective.",
0,"This design comes with two emitter heads: a small one for use below the cheekbone on sideburns, upper lip and chin, and a larger one for the body.",
0,Five intensity settings cater for a range of skin types. ,
0,"It's the largest and heaviest device, but, ""It is easiest to hold, and its main flash window is quick to use on large areas,"" says tester Rosie Asfa",
0,"After eight weeks, I found a few hairs in the test area, but they're very fine and soft.",
0, A 15-minute rapid-charge function gives 20 flashes - useful for quick touch-ups.,
0,. But having the smallest flash window in the group means it takes longer to cover the same area,
0,"After eight weeks, hair regrowth was visible, but the texture felt smooth. 7/10 ¡ê199 remington.co.uk",
0,"At 341g and 20.8cm long, Asfa was impressed by this model's lightweight, slimline body and large 3.5cm-wide flash window. ",
0,"Until recently, Tesla was the king-in-waiting for the automotive throne. ",
0," As traditional automakers turned tank-like towards an electric future, the firm looked set to whizz past in a frenzy of bold publicity and Musk-worship.",
0,"Pok¨¦mon Go finally has a working tracker, as the long-awaited Nearby feature launches in the UK.",
-1,"Hong Kong (CNN)Beijing's push to isolate Taiwan is gathering pace, with two of the island's few remaining allies switching allegiance to China in the past month.",
0,Taiwan isn't just taking heat from China diplomatically.,
-1,"Multi-national companies are being pressured over how they describe Taiwan, with Beijing insisting they follow its line that the island is an integral part of China.",
0,"Shows of force by the Chinese military in the Taiwan Strait, the narrow strip of water that divides the two, are also becoming more commonplace. ",
-1,"This ratcheting up of tensions between China and the self-governed, democratic island opens up another fault line for Washington in its dealings with Beijing, with the Trump administration already at odds with China over trade, North Korea and the South China Sea.",
-1,Washington has signaled closer support for Taiwan and a high-profile demonstration of solidarity comes in June when the United States opens a new complex to house its de facto embassy in Taipei that's three times the size of the original building. Here's what you need to know about the potential flashpoint.   ,
-1, Read MoreHow has China been piling on the pressure?,
-1,"While Beijing has been chipping away at Taiwan's shallow bench of diplomatic allies for years, the loss of two -- Burkina Faso and the Dominican Republic --  in the space of a month is unprecedented.",
-1,"Taiwan accuses Beijing of ""dollar diplomacy,"" enticing countries to switch allegiance with cash or other incentives -- a strategy that's become easier as China's grown richer and its pockets deeper.",
-1,"Beijing has also focused its attention on companies that don't toe its line on Taiwan. Some 44 airlines were recently warned not to list Taiwan separately from China on their websites and given a deadline to comply, a move the US government has described on May 5 as ""Orwellian nonsense."" ",
0," Most recently, Japanese retailer Muji has been fined for coat-hanger packaging that described Taiwan as a country.",
-1,"China has also prevented Taiwan from attending, even as an observer, the annual meeting of the World Health Organization's decision making body for two consecutive years, a move that excludes the island's 23 million people from information that helps prevent outbreak of global diseases.",
-1,No target is too small.,
-1,"In the small Australian town of Rockhampton, tiny fish-shaped Taiwan flags featured on a children's art project displayed in public were painted over, reportedly at the behest of Beijing. ",
0,Barramundi-shaped Taiwanese flags are the obscure source of public outrage after @RRCouncil painted over the symbols on a #Rockhampton students' artwork ,
0,What's China's goal?,
0,"China and Taiwan -- officially the People's Republic of China and the Republic of China, respectively -- separated in 1949 following the Communist victory in a civil war that saw the Nationalists flee to the island.",
0,"The two sides have been governed separately since, though a shared cultural and linguistic heritage mostly endures -- with Mandarin spoken as the official language in both places.",
-1,"Bringing Taiwan back to the fold has eluded China's Communist leaders for nearly seven decades and would be a huge achievement for President Xi Jinping, who now has the option to rule for life. ",
0,"Nicaraguan students wave Taiwanese flags to welcome three Taiwanese Navy warships at Corinto port, some 149 kilometers northwest of Managua, on April 9, 2018.",
0,Nicaragua is one Taiwan diplomatic allies.,
1,"Chong-Pin Lin, a former deputy defense minister in Taiwan, said he believes reunification is still a long-term goal for Xi.",
-1,"Beijing is skillful at applying psychological pressure on Taiwan, he says.",
0," President Tsai Ing-wen's Democratic Progressive Party has traditionally leaned in favor of formal independence from China, compared to Taiwan's other main political party, the Kuomintang, as the Nationalists are known locally.",
-1,"Although Tsai has been ""very prudent"" since being elected in 2016 and tried to restrain the more radical wing of her party, says Lin, Beijing may feel that she will look to appeal to her base as mid-term elections near. ",
0,"However, it's not just about the stick for Beijing. ",
1,China has also been encouraging integration. ,
1,"In February, China's Taiwan Affairs Officer revealed 31 new measures to promote exchange and cooperate with Taipei, many of which make it easier for those from Taiwan to work, do business and study in mainland China, including teachers and doctors.",
0,"View of the facade of Taiwan's Embassy in Santo Domingo, Dominican Republic, on May 1, 2018.",
0,How does the US fit in? ,
-1,"Defying strong pressure from China, Congress passed the Taiwan Travel Act, which US President Donald Trump signed into law in March, by unanimous vote in both houses.",
0,"Despite their unofficial nature, Taiwan's ties with the US, which provides arms to the island under the Taiwan Relations Act, appear strong. ",
1, It aims to make it easier for US officials to visit the island and Taiwan officials to visit the US.,
0,Another bi-partisan bill aimed at ensuring Taiwan's space in the world stage isn't diminished further was launched on Friday by Republican Sen. ,
0,Core Gardner and Democratic Sen. Edward Markey,
1,"This bipartisan legislation will help ensure that major international organizations do not turn a blind eye to our ally Taiwan simply because of China's bullying tactics, the senators said. ",
0,"And when the Trump administration opens the new American Institute in Taiwan, as the unofficial embassy is called, on June 12, it's possible that high-ranking members of the Trump administration will attend. ",
-1,"However, in Taiwan, some analysts fear that an erratic and unpredictable President Trump may use Taiwan as a bargaining chip to extract concessions in his dealings with China on North Korea or trade.",
1,"Taiwan-US relations are pretty good right now, but we don't know what the future holds,"" said Lin.",
0,"Director Kin Moy of the American Institute in Taiwan, Taiwanese President Tsai Ing-wen, AmCham Taipei Chairman Albert Chang and Alex Wong, US Deputy Assistant Secretary of State for East Asia and the Picific, toast during a banquet in Taipei on March 21, 2018.",
0,What's Taiwan doing about it?,
-1,Taiwan has long been used to operating in China's shadow.,
-1,"In 1971, the Republic of China was forced to withdraw from the United Nations after a motion was passed recognizing the People's Republic as the only lawful representative of China to the UN. ",
0,"Many other countries followed suit, including the United States, which switched diplomatic recognition to Beijing 1979 but has maintained unofficial ties with Taipei. ",
1,"Its unofficial relationships, especially with the United States, ultimately carry greater weight than its smaller, formal allies. ",
-1,"Taiwan has representative offices, which act as de facto embassies,  in more than 100 cities and a passport issued in Taiwan allows visa-free access to 148 countries, compared to 70 for China.",
-1,"Aged anti-landing barricades are positioned on a beach facing China on the Taiwanese island of Kinmen which, at points lies only a few miles from China.",
-1,Many people in Taiwan barely bat an eyelid when a diplomatic ally is lost -- seeing the money the government spends on maintaining and cultivating these small countries as a waste. ,
0,"What will be key is if Beijing's pressure has an impact on the island's more powerful allies, like the US, EU or Japan or on the companies that do business there.",
-1,"As Beijing has ramped up pressure, Taiwan's government has been more vocal in calling out Beijing's tactics.",
-1,It has publicly criticized some companies who have bowed to Beijing's pressure. And Tsai warned of a red line in a statement issued last week in the wake of Burkina Faso's decision to ditch Taiwan.,
0,And Tsai warned of a red line in a statement issued last week in the wake of Burkina Faso's decision to ditch Taiwan.,
-1,China's efforts to undermine our national sovereignty are already challenging Taiwan society's bottom line. ,
0,"This we will no longer tolerate,"" said President Tsai.",
1,We will simply redouble our resolve and continue to engage with the world.",
-1,BEIJING -- The Chinese government's goal of meeting 70% of its semiconductor needs through domestic supply remains a long way off,
0,private-sector research shows,
0,with an estimated self-sufficiency rate of 16% last year despite an all-out government push to boost production.,
-1,Hong Kong  (CNN Business)Huawei says it is in survival mode as continuous "attacks" from the United States threaten to choke off the Chinese company's access to key technology.,
-1,Huawei is in a difficult situation these days. ,
-1,"Nonstop aggression from the US government has put us under significant pressure,"" the company's rotating chief executive Guo Ping said at a conference on Wednesday.",
0," ""Right now, survival is the goal,"" he said.",
-1,"Washington has ramped up pressure on Huawei, issuing fresh sanctions in May and August that further restrict the company's access to the leading edge computer chips it needs to manufacture smartphones, 5G networking gear and other products. ",
0,China decries US bullying,
-1,New sanctions deal 'lethal blow' to Huawei. ,
0,China decries US bullyingSemiconductor companies that use American software and technology to design and manufacture chips can no longer sell to Huawei without first obtaining a license from the US Commerce Department. ,
-1,"US regulators say Huawei poses a national security risk, alleging that the Chinese government could use Huawei equipment to spy.",
0,The company has repeatedly denied those allegations.,
-1,Read MoreAnalysts have called the latest US sanctions a "lethal blow" and a "death sentence" for the company.,
-1,"The United States has been continuously attacking us and [the latest restriction] has posed great challenges to our operations, Guo told reporters. ",
1,Several analysts estimate that Huawei has stockpiled enough semiconductors to last the company through at least the end of the year. ,
-1,"But when asked how long supplies will last at a press conference on Wednesday, Guo said ""we're still evaluating more details.""",
1,"He added that Huawei buys hundreds of millions of chipsets for its smartphone business every year, and that the company received its last shipment of chips in mid-September, when the US restrictions announced in May went into effect. ",
1,"Samsung slump makes Huawei the world the biggest smartphone brand for the first time, report says",
0,"report saysMajor chipmakers such as Qualcomm (QCOM) and SK Hynix applied for licenses to sell to Huawei, according to Chinese state broadcaster CGTN.",
1,"China's biggest chipmaker, SMIC, said in a statement that it has also ""submitted license applications covering several Huawei products,"" without going into detail.",
1,"Some companies have gotten the green light, including Intel (INTC). A spokesman for the US company confirmed that it had received a license from US authorities to continue supplying Huawei, but did not specify what products it could sell. ",
1,Intel has in the past supplied processors for Huawei laptops. AMD (AMD) may also have obtained licenses to sell to Huawei.,
1,"Forrest Norrod, senior vice president of AMD, said at a conference last week that ""based on the licenses that we've been able to secure, we don't expect to see a significant impact on our business at this time",
0,"because of recent US-China trade tensions. Norrod did not specifically mention Huawei, but Jefferies analyst Edison Lee has pointed out that the California-based chip company supplies Huawei with computer processing units for laptops.",
1,"AMD obtaining a license is logical to us, since Huawei's ability to produce notebook computers should not create a national security risk to the United States,"" Lee wrote in a note on Sunday. ",
0,Huawei's telecommunications gear is another matter.,
0,The Trump administration has been urging countries around the world to ban Huawei equipment from their 5G telecom networks.,
1,Several key countries for months resisted cutting off Huawei entirely. ,
-1,"But that changed after US restrictions announced in May, barring chip companies from manufacturing chips designed by Huawei affiliate HiSilicon. ",
